{
  "audit_version": "1.12.0",
  "disclaimer": "Static analysis of a public upstream repository. No source code is redistributed, and no affiliation or upstream endorsement is implied.",
  "findings": [
    {
      "evidence": [
        {
          "detail": "HEAD=3ea751c087f32b16e039a2233dd6eefecef325d5",
          "line": null,
          "path": ".git"
        }
      ],
      "id": "AET-REPO-001",
      "impact": {
        "description": "A mismatched or dirty checkout makes line-level evidence non-reproducible.",
        "level": "high"
      },
      "recommendation": "Checkout the locked commit and remove local repository changes.",
      "rule_version": "1",
      "severity": "INFO",
      "status": "PASS",
      "title": "Repository revision is reproducibly locked"
    },
    {
      "evidence": [
        {
          "detail": "git_blob=e702436e21844c5c519de31ab68277a6d3b427d9; expected=e702436e21844c5c519de31ab68277a6d3b427d9",
          "line": 1,
          "path": "LICENSE"
        }
      ],
      "id": "AET-REPO-002",
      "impact": {
        "description": "A license mismatch or prohibited path in the evidence set invalidates publication.",
        "level": "high"
      },
      "recommendation": "Restore the locked license file and keep prohibited paths outside every include pattern.",
      "rule_version": "1",
      "severity": "INFO",
      "status": "PASS",
      "title": "License and prohibited-path boundary is enforced"
    },
    {
      "evidence": [
        {
          "detail": "category=agent; sha256=63ae3f8dbb1a5c38518b0e4b89fb7b8b1178f5c5df951ca2da1c1f92ade372bd",
          "line": 1,
          "path": "sweagent/agent/action_sampler.py"
        },
        {
          "detail": "category=agent; sha256=d6cdf7ac66a6509ceba08e3541b856f0734acf79f9a485ed8a6e2c72f0d211a8",
          "line": 1,
          "path": "sweagent/agent/agents.py"
        },
        {
          "detail": "category=tool; sha256=13d6d79fa4f6be7604eb580c5b59c5c1538e49f1f6a414810b4d7b944e47df2e",
          "line": 1,
          "path": "sweagent/tools/bundle.py"
        },
        {
          "detail": "category=tool; sha256=f4267d069350a78eaf83e2556a01923b76ea3724cd0016f9317db663b5f524af",
          "line": 1,
          "path": "sweagent/tools/commands.py"
        },
        {
          "detail": "category=trajectory; sha256=dd79a193908492a51f532269ee126f3600da98b84551e2bdc1adacc7bf29ad67",
          "line": 1,
          "path": "tests/test_data/trajectories/gpt4__swe-agent-test-repo__default_from_url__t-0.00__p-0.95__c-3.00__install-1/6e44b9__sweagenttestrepo-1c2844.traj"
        },
        {
          "detail": "category=trajectory; sha256=964996408c99e48aa2503f87029f252a28593bf2570a9ee02ba502cd77529032",
          "line": 1,
          "path": "tests/test_data/trajectories/gpt4__swe-agent-test-repo__default_from_url__t-0.00__p-0.95__c-3.00__install-1/solution_missing_colon.py"
        },
        {
          "detail": "category=verification; sha256=ccb00ddbff2cb5e9937e39dbff0ddbf1afbedb5d9a7e5ad1b9cea8977b97502d",
          "line": 1,
          "path": "tests/test_agent.py"
        },
        {
          "detail": "category=verification; sha256=dd79a193908492a51f532269ee126f3600da98b84551e2bdc1adacc7bf29ad67",
          "line": 1,
          "path": "tests/test_data/trajectories/gpt4__swe-agent-test-repo__default_from_url__t-0.00__p-0.95__c-3.00__install-1/6e44b9__sweagenttestrepo-1c2844.traj"
        }
      ],
      "id": "AET-REPO-003",
      "impact": {
        "description": "The scoped checkout contains static Agent, tool, trajectory, and verification evidence.",
        "level": "high"
      },
      "recommendation": "Bind completion claims to an explicit trajectory and verification artifact.",
      "rule_version": "1",
      "severity": "INFO",
      "status": "PASS",
      "title": "Agent loop evidence is traceable"
    },
    {
      "evidence": [
        {
          "detail": "category=tool; sha256=13d6d79fa4f6be7604eb580c5b59c5c1538e49f1f6a414810b4d7b944e47df2e",
          "line": 1,
          "path": "sweagent/tools/bundle.py"
        },
        {
          "detail": "category=tool; sha256=f4267d069350a78eaf83e2556a01923b76ea3724cd0016f9317db663b5f524af",
          "line": 1,
          "path": "sweagent/tools/commands.py"
        },
        {
          "detail": "category=recovery; sha256=63ae3f8dbb1a5c38518b0e4b89fb7b8b1178f5c5df951ca2da1c1f92ade372bd",
          "line": 59,
          "path": "sweagent/agent/action_sampler.py"
        },
        {
          "detail": "category=recovery; sha256=d6cdf7ac66a6509ceba08e3541b856f0734acf79f9a485ed8a6e2c72f0d211a8",
          "line": 340,
          "path": "sweagent/agent/agents.py"
        }
      ],
      "id": "AET-REPO-004",
      "impact": {
        "description": "The scoped checkout does not statically prove all tool-governance controls. Missing categories: permission.",
        "level": "high"
      },
      "recommendation": "Keep permission, feedback, and failure behavior explicit at each tool boundary.",
      "rule_version": "1",
      "severity": "WARN",
      "status": "UNKNOWN",
      "title": "Tool interaction controls are visible"
    },
    {
      "evidence": [
        {
          "detail": "category=trajectory; sha256=dd79a193908492a51f532269ee126f3600da98b84551e2bdc1adacc7bf29ad67",
          "line": 1,
          "path": "tests/test_data/trajectories/gpt4__swe-agent-test-repo__default_from_url__t-0.00__p-0.95__c-3.00__install-1/6e44b9__sweagenttestrepo-1c2844.traj"
        },
        {
          "detail": "category=trajectory; sha256=964996408c99e48aa2503f87029f252a28593bf2570a9ee02ba502cd77529032",
          "line": 1,
          "path": "tests/test_data/trajectories/gpt4__swe-agent-test-repo__default_from_url__t-0.00__p-0.95__c-3.00__install-1/solution_missing_colon.py"
        },
        {
          "detail": "category=verification; sha256=ccb00ddbff2cb5e9937e39dbff0ddbf1afbedb5d9a7e5ad1b9cea8977b97502d",
          "line": 1,
          "path": "tests/test_agent.py"
        },
        {
          "detail": "category=verification; sha256=dd79a193908492a51f532269ee126f3600da98b84551e2bdc1adacc7bf29ad67",
          "line": 1,
          "path": "tests/test_data/trajectories/gpt4__swe-agent-test-repo__default_from_url__t-0.00__p-0.95__c-3.00__install-1/6e44b9__sweagenttestrepo-1c2844.traj"
        },
        {
          "detail": "category=feedback; sha256=881580a98eef5942d9e3be759fa6a7901c162b9fe1279d9beb334e969688ad10",
          "line": 164,
          "path": "sweagent/agent/reviewer.py"
        }
      ],
      "id": "AET-REPO-005",
      "impact": {
        "description": "Trajectory, verification, and result-feedback evidence are present in the bounded scope.",
        "level": "medium"
      },
      "recommendation": "Record a stable link from each completion claim to its verification result.",
      "rule_version": "1",
      "severity": "INFO",
      "status": "PASS",
      "title": "Completion evidence is inspectable"
    }
  ],
  "generated_at": "2026-07-23T07:29:06.953800+00:00",
  "llm": {
    "affects_findings": false,
    "execution_time_seconds": 0,
    "model_name": null,
    "status": "NOT_APPLICABLE",
    "token_usage": null
  },
  "report_kind": "repository_audit",
  "repository": {
    "branch": "main",
    "case_id": "swe-agent",
    "commit": "3ea751c087f32b16e039a2233dd6eefecef325d5",
    "license": {
      "blob_sha": "e702436e21844c5c519de31ab68277a6d3b427d9",
      "path": "LICENSE",
      "spdx": "MIT"
    },
    "name": "SWE-agent",
    "url": "https://github.com/SWE-agent/SWE-agent"
  },
  "review": {
    "required_before_publication": true,
    "status": "APPROVED"
  },
  "runtime": {
    "excludes": [
      "clone",
      "dependency_install",
      "llm_network",
      "manual_review"
    ],
    "max_seconds": 900.0,
    "total_seconds": 0.138405,
    "within_budget": true
  },
  "schema_version": "repository-audit-result/v1",
  "scope": {
    "exclude": [
      "docs/**",
      "benchmark/**",
      "examples/**"
    ],
    "files_collected": 52,
    "files_skipped": [],
    "include": [
      "sweagent/agent/**",
      "sweagent/environment/**",
      "sweagent/tools/**",
      "trajectories/**",
      "tests/test_agent.py",
      "tests/test_tools_command_parsing.py",
      "tests/test_data/trajectories/**"
    ]
  },
  "summary": {
    "FAIL": 0,
    "NOT_APPLICABLE": 0,
    "PASS": 4,
    "UNKNOWN": 1
  }
}
